"SmartVM: A Smart Contract Virtual Machine for Fast On-Chain DNN Computations","T. Li; Y. Fang; Y. Lu; J. Yang; Z. Jian; Z. Wan; Y. Li","College of Computer Science, Nankai University, Tianjin, China; College of Computer Science, Nankai University, Tianjin, China; College of Computer Science, Nankai University, Tianjin, China; College of Cyber Science, Nankai University, Tianjin, China; College of Computer Science, Nankai University, Tianjin, China; Zhejiang Lab, Hangzhou, Zhejiang, China; College of Computer Science, Nankai University, Tianjin, China","IEEE Transactions on Parallel and Distributed Systems","22 Sep 2022","2022","33","12","4100","4116","Blockchain-based artificial intelligence (BC-AI) has been applied for protecting deep neural network (DNN) data from being tampered with, which is expected to further boost trusted distributed AI applications in many fields. However, due to smart contract execution environment architectural defects, it is challenging for previous BC-AI systems to support computing-intensive tasks on-chain performing such as DNN convolution operations. They have to offload computations and a large amount of data from blockchain to off-chain platforms to execute smart contracts as native code. This failure to take advantage of data locality has become one of the major critical performance bottlenecks in BC-AI system. To this end, in this article, we propose SmartVM with optimization methods to support on-chain DNN inference for BC-AI system. The key idea is to design and optimize the computing mechanism and storage structure of smart contract execution environment according to the characteristics of DNN such as high computational parallelism and large data volume. We decompose SmartVM into three components: 1) a compact DNN-oriented instruction set to describe computations in a short number of instructions to reduce interpretation time. 2) a memory management mechanism to make SmartVM memory dynamic free/allocated according to the size of DNN feature maps. 3) a block-based weight prefetching and parallel computing method to organize each layer's computing and weights prefetching in a pipelined manner. We perform the typical image classification in a private Ethereum blockchain testbed to evaluate SmartVM performance. Experimental results highlight that SmartVM can support DNN inference on-chain with roughly the same efficiency against the native code execution. Compared with the traditional off-chain computing, SmartVM can speed up the overall execution by 70×, 16×, 11×, and 12× over LeNet5, AlexNet, ResNet18, and MobileNet, respectively. The memory footprint can be reduced by 84%, 90.8%, 94.3%, and 93.7% over the above four models, while offering the same level model accuracy. This article sheds light on the design space of the smart contract virtual machine for DNN computation and is promising to further boost BC-AI applications.","1558-2183","","10.1109/TPDS.2022.3177405","CCF-AFSG Research Fund(grant numbers:CCF-AFSG RF20210031); Special Funding for Excellent Enterprise Technology Correspondent of Tianjin(grant numbers:21YDTPJC00380); National Natural Science Foundation of China(grant numbers:62002175); Open Project Fund of State Key Laboratory of Computer Architecture; Institute of Computing Technology, Chinese Academy of Sciences(grant numbers:CARCHB202016); Key Research Project of Zhejiang Lab(grant numbers:2021KF0AB04); Natural Science Foundation of Tianjin City(grant numbers:20JCZDJC00610); Foundation of Information Security Evaluation Center of Civil Aviation; Civil Aviation University of China(grant numbers:ISECCA-202102); People's Republic of China ministry of education science and technology development center(grant numbers:2019J02019); Tianjin Graduate Scientific Research Innovation Project(grant numbers:2021YJSB014); ","https://ieeexplore.ieee.org/stamp/stamp.jsp?arnumber=9780577","Deep neural network;smart contract;virtual machine;architectural support technology","Smart contracts;Blockchains;Virtual machining;Convolutional neural networks;Convolution;Task analysis;Random access memory","deep learning (artificial intelligence);image classification;instruction sets;multiprocessing systems;power aware computing;storage management;virtual machines","memory management mechanism;SmartVM memory dynamic free;DNN feature maps;block-based weight prefetching;private Ethereum blockchain;SmartVM performance;DNN inference on-chain;off-chain computing;smart contract virtual machine;boost BC-AI applications;blockchain-based artificial intelligence;deep neural network data;smart contract execution environment architectural defects;computing-intensive tasks on-chain performing;DNN convolution operations;off-chain platforms;data locality;BC-AI system;optimization methods;DNN such as high computational parallelism;fast on-chain DNN computations;parallel computing method;image classification;DNN-oriented instruction;instruction set","","","","52","IEEE","24 May 2022","","","IEEE","IEEE Journals"
"Security Smells in Smart Contracts","M. Demir; M. Alalfi; O. Turetken; A. Ferworn","Department of Computer Science, Ryerson University, Toronto, Canada; Department of Computer Science, Ryerson University, Toronto, Canada; Ted Rogers School of Information Technology Management, Ryerson University, Toronto, Canada; Department of Computer Science, Ryerson University, Toronto, Canada","2019 IEEE 19th International Conference on Software Quality, Reliability and Security Companion (QRS-C)","7 Oct 2019","2019","","","442","449","The popularity of blockchain technology encourages organizations to use more blockchain features in mission-critical processes such as trading, access control, and computational public safety. Automation of processes with smart contracts is one of these features that significantly enlarge the scope of a blockchain implementation. Smart contracts help automate business processes by modeling business activities on the distributed ledger. Smart contracts are significantly different from other programs from a defect fixing and security issue handling perspective. The opportunity of fixing such issues is only available in the narrow window before registering the contract on to the blockchain. After a smart contract becomes a part of the chain, it is not possible to update or fix any issues. This distinct nature of smart contracts makes it essential to detect the program issues early on by paying attention to security smells. Security smells are clues that point to a deeper problem in the programming space. In this study, we review the literature and identify vulnerabilities that programmers and beneficiaries of smart contracts must avoid. We explain these security smells and categorize them based on their nature. We also review the applications that detect these vulnerabilities and provide information about their approach and coverage. Our main contribution is the evaluation of smart contracts as a platform or aid for mission-critical applications such as access control platforms. We conducted this evaluation by identifying the issues related to smart contracts and informing the reader about the problem, challenges, and techniques. We conclude by defining future directions for our research.","","978-1-7281-3925-8","10.1109/QRS-C.2019.00086","","https://ieeexplore.ieee.org/stamp/stamp.jsp?arnumber=8859521","security smells, program analysis, blockchain, smart contracts","Smart contracts;Blockchain;Security;Tools;Programming","authorisation;business data processing;contracts;cryptography","security smells;smart contract;blockchain technology;mission-critical process;business process;access control platforms","","8","","29","IEEE","7 Oct 2019","","","IEEE","IEEE Conferences"
"Detect Defects of Solidity Smart Contract Based on the Knowledge Graph","T. Hu; B. Li; Z. Pan; C. Qian","School of Computer Science and Engineering, Southeast University, Nanjing, China; School of Computer Science and Engineering, Southeast University, Nanjing, China; School of Computer Science and Engineering, Southeast University, Nanjing, China; School of Computer Science and Engineering, Southeast University, Nanjing, China","IEEE Transactions on Reliability","","2023","PP","99","1","17","Smart contract security is one of the core issues in any application based on blockchain. There are many techniques focusing on smart contract security, however, due to the diversity of Solidity versions and limitations of detection time, it is difficult for them to comprehensively localize defects in different versions of smart contracts. In this article, we propose a static defect detection method based on the knowledge graph of the Solidity language and present a defect detection tool called SoliDetector. First, we define the ontology layer of the knowledge graph and construct the instance layer in which syntactic and logical relationships are captured. Second, we introduce the defect pattern to describe each defect and design inference rules to infer complex relationships and judge whether a defect exists. Finally, we localize defects by executing SPARQL queries. SoliDetector can support the detection of 20 kinds of defects and the automatic SPARQL query generation. We conducted several experiments on multiple datasets. SoliDetector obtains a high F-score (i.e., 92.97% on Dataset1 and 91.54% on the SmartBug dataset). To compare SoliDetector with SmartCheck, Slither, and Mythril, we conducted experiments on a labeled benchmark Dataset3 and real-world contracts. SoliDetector has a high F-score of 94.04% and is faster than other tools with an average time of 0.37 s for each contract.","1558-1721","","10.1109/TR.2023.3233999","National Key Research and Development Program of China(grant numbers:2019YFE0105500); Research Council of Norway(grant numbers:309494); Key Research and Development Program of Jiangsu Province(grant numbers:BE2021002-3); ","https://ieeexplore.ieee.org/stamp/stamp.jsp?arnumber=10025570","Defect pattern;inference rule;knowledge graph;SPARQL query;smart contract","Smart contracts;Codes;Syntactics;Ontologies;Source coding;Data mining;Security","","","","1","","","IEEE","24 Jan 2023","","","IEEE","IEEE Early Access Articles"
"A Critical-Path-Coverage-Based Vulnerability Detection Method for Smart Contracts","M. Fu; L. Wu; Z. Hong; F. Zhu; H. Sun; W. Feng","Command and Control Engineering College, Army Engineering University of PLA, Nanjing, China; School of Computer Science, Nanjing University of Posts and Telecommunications, Nanjing, China; Command and Control Engineering College, Army Engineering University of PLA, Nanjing, China; School of Computer Science, Nanjing University of Posts and Telecommunications, Nanjing, China; Command and Control Engineering College, Army Engineering University of PLA, Nanjing, China; Command and Control Engineering College, Army Engineering University of PLA, Nanjing, China","IEEE Access","21 Oct 2019","2019","7","","147327","147344","The second generation of blockchain represented by smart contracts has been developing vigorously in recent years. However, frequent smart contract vulnerability incidents pose a serious risk to blockchain ecosystem security. Since current symbol execution tools often fall into path explosion and thus lead to inefficient detection, this paper expands Mythril's framework to optimize its performance. Firstly, it finds out potential vulnerable code regions using static analysis and identifies critical paths that may have security defects. Then, aiming at the problem that traditional search algorithms cannot actively locate and explore critical paths, this paper presents a multi-objective oriented path search (MOPS) strategy based on path priority. This strategy guides dynamic symbolic execution to cover critical paths quickly, avoiding blind traversal of program execution paths. Finally, it describes security rules and proposes corresponding detection logics for different vulnerability categories. This paper analyzes over 1000 smart contracts extracted from Etherscan. Compared with existing tools based on symbolic execution, the proposed method can reduce time consumption by around 35% while ensuring the accuracy of vulnerability detection. Moreover, existing tools often issue warnings that do not actually cause financial losses. But the proposed method only concentrates on code regions related to transfer of funds, so it can reduce the false alarm rate to some extent.","2169-3536","","10.1109/ACCESS.2019.2947146","National Basic Research Program of China (973 Program)(grant numbers:2017YFB08029); Nanjing University of Posts and Telecommunications(grant numbers:NY219004); ","https://ieeexplore.ieee.org/stamp/stamp.jsp?arnumber=8867880","Block chain security;smart contract;vulnerability mining","Smart contracts;Security;Tools;Semantics;Blockchain;Explosions","contracts;cryptocurrencies;program diagnostics;program testing;search problems","detection logics;ecosystem security;frequent smart contract vulnerability incidents;critical-path-coverage-based vulnerability detection method;vulnerability categories;program execution paths;dynamic symbolic execution;path priority;multiobjective oriented path search strategy;traditional search algorithms;security defects;critical paths;potential vulnerable code regions;path explosion;current symbol execution tools","","10","","42","CCBY","14 Oct 2019","","","IEEE","IEEE Journals"
"Towards Eidetic Blockchain Systems with Enhanced Provenance","S. Linoy; S. Ray; N. Stakhanova","Faculty of Computer Science, University of New Brunswick, Fredericton, Canada; Faculty of Computer Science, University of New Brunswick, Fredericton, Canada; Department of Computer Science, University of Saskatchewan, Saskatoon, Canada","2020 IEEE 36th International Conference on Data Engineering Workshops (ICDEW)","15 May 2020","2020","","","7","10","Modern blockchain systems with smart contract support are continuing to be rapidly adopted across various industry sectors and are increasingly used to manage valuable assets. As the size and complexity of smart contract applications increases, so are the coding errors, exploit potential, and regulation requirements. For these reasons, it has become necessary to efficiently manage the system's historic execution information, or provenance, to enable efficient analysis. Existing approaches facilitate historic data access, however, they do not support tracking what initiated the changes or why the states mutated. To address this, we propose a system that enables efficient management of historic smart contracts calls, their parameters, and the blockchain state before and after a call. We further explore how querying this historic data in different granularity levels can facilitate the analysis of a use case example comprised of multiple smart contract calls across different entities.","2473-3490","978-1-7281-4266-1","10.1109/ICDEW49219.2020.00-14","","https://ieeexplore.ieee.org/stamp/stamp.jsp?arnumber=9094120","Blockchain;provenance;call graph;defect analysis;debugging;regulatory requirements;audit","Smart contracts;Blockchain;Debugging","contracts;data mining","valuable assets;smart contract applications;coding errors;historic data access;blockchain state;multiple smart contract;industry sectors;eidetic blockchain systems;historic smart contracts","","2","","18","IEEE","15 May 2020","","","IEEE","IEEE Conferences"
"EtherSolve: Computing an Accurate Control-Flow Graph from Ethereum Bytecode","F. Contro; M. Crosara; M. Ceccato; M. D. Preda","Computer Science department, University of Verona; Computer Science department, University of Verona; Computer Science department, University of Verona; Computer Science department, University of Verona","2021 IEEE/ACM 29th International Conference on Program Comprehension (ICPC)","28 Jun 2021","2021","","","127","137","Motivated by the immutable nature of Ethereum smart contracts and of their transactions, quite many approaches have been proposed to detect defects and security problems before smart contracts become persistent in the blockchain and they are granted control on substantial financial value. Because smart contracts source code might not be available, static analysis approaches mostly face the challenge of analysing compiled Ethereum bytecode, that is available directly from the official blockchain. However, due to the intrinsic complexity of Ethereum bytecode (especially in jump resolution), static analysis encounters significant obstacles that reduce the accuracy of exiting automated tools. This paper presents a novel static analysis algorithm based on the symbolic execution of the Ethereum operand stack that allows us to resolve jumps in Ethereum bytecode and to construct an accurate control-flow graph (CFG) of the compiled smart contracts. EtherSolve is a prototype implementation of our approach. Experimental results on a significant set of real world Ethereum smart contracts show that EtherSolve improves the accuracy of the execrated CFGs with respect to the state of the art available approaches. Many static analysis techniques are based on the CFG representation of the code and would therefore benefit from the accurate extraction of the CFG. For example, we implemented a simple extension of EtherSolve that allows to detect instances of the re-entrancy vulnerability.","2643-7171","978-1-6654-1403-6","10.1109/ICPC52881.2021.00021","Dipartimenti di Eccellenza; ","https://ieeexplore.ieee.org/stamp/stamp.jsp?arnumber=9462980","Reverse engineering;Static analysis;Smart contract;Ethereum","Smart contracts;Prototypes;Static analysis;Blockchain;Detectors;Tools;Complexity theory","blockchains;contracts;flow graphs;Java;program diagnostics","official blockchain;static analysis algorithm;Ethereum operand stack;accurate control-flow graph;compiled smart contracts;EtherSolve;Ethereum smart contracts;static analysis techniques;security problems;substantial financial value;smart contracts source code;compiled Ethereum bytecode","","1","","42","IEEE","28 Jun 2021","","","IEEE","IEEE Conferences"
"TokenCat: Detect Flaw of Authentication on ERC20 Tokens","Z. He; Z. Liao; F. Luo; D. Liu; T. Chen; Z. Li","Center Of Cyber Security, University of Electronic Science and Technology of China; Center Of Cyber Security, University of Electronic Science and Technology of China; Center Of Cyber Security, University of Electronic Science and Technology of China; Foundational Security, Ant Group; Center Of Cyber Security, University of Electronic Science and Technology of China; Department of Computing, The Hong Kong Polytechnic University","ICC 2022 - IEEE International Conference on Communications","11 Aug 2022","2022","","","4999","5004","The development of blockchain has promoted the prosperity of the cryptocurrency ecosystem. The majority of cryptocurrencies are ERC20 tokens implemented based on Ethereum contracts. The major role of ERC20 tokens is to carry out various trades and loans in decentralized applications (DApps). To participate in DApps, users must grant the DApps permission to spend tokens on user behalf. However, if the authorization logic of token contract is flawed implementation, the holder of token will suffer tremendous financial losses. In this work, we detect the authentication implementation of the flaws in ERC20 token, which has not been done before. We find the authentication process of the token is implemented by operating the authentication data structure of the token. Therefore, we capture the operations of the authentication data structure in token contract to infer authentication behaviors and detect authentication defects. However, it’s not a simple task as most smart contracts are not open source and the bytecode of token contract lacks type information. To tackle these problems, we utilize symbolic execution on the token bytecode, then identify the authentication data structure and capture the operations by parsing the symbolic expressions, and finally detect authentication defects through the inferred authentication behavior. To best our knowledge, this is the first work to detect the flaws in the implementation of authentication in ERC20 Token. To automate the analysis, we implement our approach in a new tool named TokenCat and use it to inspect 245,822 tokens. As a result, the TokenCat found 491 ERC20 token authentication implementation flaws with 94% precision.","1938-1883","978-1-5386-8347-7","10.1109/ICC45855.2022.9839252","National Natural Science Foundation of China; National Natural Science Foundation of China; ","https://ieeexplore.ieee.org/stamp/stamp.jsp?arnumber=9839252","Ethereum;smart contract;token;ERC20;authentication","Authorization;Smart contracts;Ecosystems;Authentication;Decentralized applications;Data structures;Cryptocurrency","blockchains;contracts;cryptocurrencies;data structures;financial data processing;message authentication","token contract;token bytecode;authentication data structure;TokenCat;ERC20 token authentication;blockchain;cryptocurrencies;Ethereum contracts;decentralized applications;DApps;symbolic expression parsing;authentication defect detection","","","","14","IEEE","11 Aug 2022","","","IEEE","IEEE Conferences"
"BC-BLPM: A multi-level security access control model based on blockchain technology","X. Yu; Z. Shu; Q. Li; J. Huang","College of Computer Science, National University of Defense Technology, Changsha, China; College of Electronic Engineering, National University of Defense Technology, Hefei, China; College of Electronic Engineering, National University of Defense Technology, Hefei, China; College of Electronic Engineering, National University of Defense Technology, Hefei, China","China Communications","15 Feb 2021","2021","18","2","110","135","Traditional multi-level security (MLS) systems have the defect of centralizing authorized facilities, which is difficult to meet the security requirements of modern distributed peer-to-peer network architecture. Blockchain is widely used in the field of access control with its decentralization, traceability and non-defective modification. Combining the blockchain technology and the Bell-LaPadula model, we propose a new access control model, named BC-BLPM, for MLS environment. The “multi-chain” blockchain architecture is used for dividing resources into isolated access domains, providing a fine-grained data protection mechanism. The access control policies are implemented by smart contracts deployed in each access domain, so that the side chains of different access domains storage access records from outside and maintain the integrity of the records. Finally, we implement the BC-BLPM prototype system using the Hyperledger Fabric. The experimental and analyt-ical results show that the model can adapt well to the needs of multi-level security environment, and it has the feasibility of application in actual scenarios.","1673-5447","","10.23919/JCC.2021.02.008","","https://ieeexplore.ieee.org/stamp/stamp.jsp?arnumber=9354738","multi-level security (MLS);access control;blockchain;multi-chain;smart contract","Security;Blockchain;Access control;Smart contracts;Peer-to-peer computing;Computational modeling;Cloud computing","access control;authorisation;blockchains;peer-to-peer computing","security requirements;peer-to-peer network architecture;nondefective modification;blockchain technology;Bell-LaPadula model;MLS environment;multichain blockchain architecture;isolated access domains;fine-grained data protection mechanism;access control policies;BC-BLPM prototype system;multilevel security environment;multilevel security access control model;traditional multilevel security systems;authorized facilities;access domains storage access records","","8","","","","15 Feb 2021","","","IEEE","IEEE Magazines"
